{
  "version": "0.0.8",
  "schemaVersion": "0.0.1",
  "name": "RADAR MAAM QMUL s1",
  "healthIssues": ["ADHD", "menstrual", "menopause"],
  "protocols": [
    {
      "name": "Day B Core Questionnaire",
      "showIntroduction": true,
      "showInCalendar": true,
      "isDemo": false,
      "order": 0,
      "questionnaire": {
        "repository": "https://raw.githubusercontent.com/RADAR-CNS/RADAR-REDCap-aRMT-Definitions/master/questionnaires/",
        "name": "maam_day_b_core",
        "avsc": "questionnaire"
      },
      "startText": {
        "en": "",
        "it": "",
        "nl": "",
        "da": "",
        "de": "",
        "es": ""
      },
      "endText": {
        "en": "",
        "it": "",
        "nl": "",
        "da": "",
        "de": "",
        "es": ""
      },
      "warn": {
        "en": "",
        "it": "",
        "nl": "",
        "da": "",
        "de": "",
        "es": ""
      },
      "estimatedCompletionTime": 2,
      "protocol": {
        "repeatProtocol": {
          "unit": "day",
          "amount": 2
        },
        "repeatQuestionnaire": {
          "unit": "min",
          "unitsFromZero": [
            2460
          ]
        },
        "reminders": {
          "unit": "hour",
          "amount": 3,
          "repeat": 1
        },
        "completionWindow": {
          "unit": "hour",
          "amount": 7
        },
        "notification": {
          "title": {
            "en": "Questionnaire time"
          },
          "text": {
            "en": "Please complete these questionnaires this evening reflecting on your day. You will also receive a reminder in 3 hours if you haven't completed them by then."
          }
        }
      }
    },
    {
      "name": "Day B Extra Questionnaire",
      "showIntroduction": true,
      "showInCalendar": true,
      "isDemo": false,
      "order": 1,
      "questionnaire": {
        "repository": "https://raw.githubusercontent.com/RADAR-CNS/RADAR-REDCap-aRMT-Definitions/master/questionnaires/",
        "name": "maam_day_b_extra",
        "avsc": "questionnaire"
      },
      "startText": {
        "en": "",
        "it": "",
        "nl": "",
        "da": "",
        "de": "",
        "es": ""
      },
      "endText": {
        "en": "",
        "it": "",
        "nl": "",
        "da": "",
        "de": "",
        "es": ""
      },
      "warn": {
        "en": "",
        "it": "",
        "nl": "",
        "da": "",
        "de": "",
        "es": ""
      },
      "estimatedCompletionTime": 2,
      "protocol": {
        "repeatProtocol": {
          "unit": "day",
          "amount": 2
        },
        "repeatQuestionnaire": {
          "unit": "min",
          "unitsFromZero": [
            2460
          ]
        },
        "reminders": {
          "unit": "hour",
          "amount": 3,
          "repeat": 1
        },
        "completionWindow": {
          "unit": "hour",
          "amount": 7
        },
        "notification": {
          "title": {
            "en": "Questionnaire time"
          },
          "text": {
            "en": "Please complete these questionnaires this evening reflecting on your day. You will also receive a reminder in 3 hours if you haven't completed them by then."
          }
        }
      }
    },
    {
      "name": "Day A Core Questionnaire",
      "showIntroduction": true,
      "showInCalendar": true,
      "isDemo": false,
      "order": 0,
      "questionnaire": {
        "repository": "https://raw.githubusercontent.com/RADAR-CNS/RADAR-REDCap-aRMT-Definitions/master/questionnaires/",
        "name": "maam_day_a_core",
        "avsc": "questionnaire"
      },
      "startText": {
        "en": "",
        "it": "",
        "nl": "",
        "da": "",
        "de": "",
        "es": ""
      },
      "endText": {
        "en": "",
        "it": "",
        "nl": "",
        "da": "",
        "de": "",
        "es": ""
      },
      "warn": {
        "en": "",
        "it": "",
        "nl": "",
        "da": "",
        "de": "",
        "es": ""
      },
      "estimatedCompletionTime": 2,
      "protocol": {
        "repeatProtocol": {
          "unit": "day",
          "amount": 2
        },
        "repeatQuestionnaire": {
          "unit": "min",
          "unitsFromZero": [
            1020
          ]
        },
        "reminders": {
          "unit": "hour",
          "amount": 3,
          "repeat": 1
        },
        "completionWindow": {
          "unit": "hour",
          "amount": 7
        },
        "notification": {
          "title": {
            "en": "Questionnaire time"
          },
          "text": {
            "en": "Please complete these questionnaires this evening reflecting on your day. You will also receive a reminder in 3 hours if you haven't completed them by then."
          }
        }
      }
    },
    {
      "name": "Day A Extra Questionnaire",
      "showIntroduction": true,
      "showInCalendar": true,
      "isDemo": false,
      "order": 1,
      "questionnaire": {
        "repository": "https://raw.githubusercontent.com/RADAR-CNS/RADAR-REDCap-aRMT-Definitions/master/questionnaires/",
        "name": "maam_day_a_extra",
        "avsc": "questionnaire"
      },
      "startText": {
        "en": "",
        "it": "",
        "nl": "",
        "da": "",
        "de": "",
        "es": ""
      },
      "endText": {
        "en": "",
        "it": "",
        "nl": "",
        "da": "",
        "de": "",
        "es": ""
      },
      "warn": {
        "en": "",
        "it": "",
        "nl": "",
        "da": "",
        "de": "",
        "es": ""
      },
      "estimatedCompletionTime": 2,
      "protocol": {
        "repeatProtocol": {
          "unit": "day",
          "amount": 2
        },
        "repeatQuestionnaire": {
          "unit": "min",
          "unitsFromZero": [
            1020
          ]
        },
        "reminders": {
          "unit": "hour",
          "amount": 3,
          "repeat": 1
        },
        "completionWindow": {
          "unit": "hour",
          "amount": 7
        },
        "notification": {
          "title": {
            "en": "Questionnaire time"
          },
          "text": {
            "en": "Please complete these questionnaires this evening reflecting on your day. You will also receive a reminder in 3 hours if you haven't completed them by then."
          }
        }
      }
    }
  ]
}
