{
  "version": "0.0.3",
  "schemaVersion": "0.0.3",
  "name": "RADAR-Demo UKIV conference",
  "healthIssues": ["Demo"],
  "protocols": [
    {
      "name": "Bergen Social Media Addiction Scale",
      "type": "on_demand",
      "showIntroduction": true,
      "questionnaire": {
        "repository": "https://raw.githubusercontent.com/RADAR-base/RADAR-REDCap-aRMT-Definitions/master/questionnaires/",
        "name": "bergen_social_media_addiction_scale",
        "avsc": "questionnaire"
      },
      "startText": {
        "en": "",
        "it": "",
        "nl": "",
        "da": "",
        "de": "",
        "es": ""
      },
      "endText": {
        "en": "",
        "it": "",
        "nl": "",
        "da": "",
        "de": "",
        "es": ""
      },
      "warn": {
        "en": "",
        "it": "",
        "nl": "",
        "da": "",
        "de": "",
        "es": ""
      },
      "estimatedCompletionTime": 3,
      "protocol": {
        "repeatProtocol": {
          "unit": "day",
          "amount": 1
        },
        "repeatQuestionnaire": {
          "unit": "min",
          "unitsFromZero": [
            480,490,500,510,520,530,540,550,560,570,580,590,600,610,620,630,640,650,660,670,680,690,700,710,720,730,740,750,760,770,780,790,800,810,820,830,840,850,860,870,880,890,900,910,920,930,940,950,960,970,980,990,1000,1010,1020,1030,1040,1050,1060,1070
          ]
        },
        "reminders": {
          "unit": "day",
          "amount": 0,
          "repeat": 0
        }
      }
    },
    {
      "name": "Smartphone Usage Opportunity",
      "type": "on_demand",
      "showIntroduction": true,
      "questionnaire": {
        "repository": "https://raw.githubusercontent.com/RADAR-base/RADAR-REDCap-aRMT-Definitions/master/questionnaires/",
        "name": "smartphone_usage_opportunity",
        "avsc": "questionnaire"
      },
      "startText": {
        "en": "",
        "it": "",
        "nl": "",
        "da": "",
        "de": "",
        "es": ""
      },
      "endText": {
        "en": "",
        "it": "",
        "nl": "",
        "da": "",
        "de": "",
        "es": ""
      },
      "warn": {
        "en": "",
        "it": "",
        "nl": "",
        "da": "",
        "de": "",
        "es": ""
      },
      "estimatedCompletionTime": 3,
      "protocol": {
        "repeatProtocol": {
          "unit": "day",
          "amount": 1
        },
        "repeatQuestionnaire": {
          "unit": "min",
          "unitsFromZero": [
            480,490,500,510,520,530,540,550,560,570,580,590,600,610,620,630,640,650,660,670,680,690,700,710,720,730,740,750,760,770,780,790,800,810,820,830,840,850,860,870,880,890,900,910,920,930,940,950,960,970,980,990,1000,1010,1020,1030,1040,1050,1060,1070
          ]
        },
        "reminders": {
          "unit": "day",
          "amount": 0,
          "repeat": 0
        }
      }
    },
    {
      "name": "AUDIO_COUNT",
      "showIntroduction": false,
      "showInCalendar": true,
      "isDemo": false,
      "order": 9,
      "questionnaire": {
        "repository": "https://raw.githubusercontent.com/RADAR-CNS/RADAR-REDCap-aRMT-Definitions/master/questionnaires/",
        "name": "audio_count",
        "avsc": "questionnaire"
      },
      "startText": {
        "en": "",
        "it": "",
        "nl": "",
        "da": "",
        "de": "",
        "es": ""
      },
      "endText": {
        "en": "",
        "it": "",
        "nl": "",
        "da": "",
        "de": "",
        "es": ""
      },
      "warn": {
        "en": "Find a quiet space.",
        "it": "Trova uno spazio tranquillo.",
        "nl": "Zoek een stille ruimte.",
        "da": "Find et roligt sted.",
        "de": "Suchen Sie sich einen ruhigen Platz.",
        "es": "Encuentra un espacio tranquilo."
      },
      "estimatedCompletionTime": 3,
      "protocol": {
        "repeatProtocol": {
          "unit": "day",
          "amount": 1
        },
        "repeatQuestionnaire": {
          "unit": "min",
          "unitsFromZero": [
            480,490,500,510,520,530,540,550,560,570,580,590,600,610,620,630,640,650,660,670,680,690,700,710,720,730,740,750,760,770,780,790,800,810,820,830,840,850,860,870,880,890,900,910,920,930,940,950,960,970,980,990,1000,1010,1020,1030,1040,1050,1060,1070
          ]
        },
        "reminders": {
          "unit": "day",
          "amount": 0,
          "repeat": 0
        }
      }
    }
  ]
}
