{
    "version": "0.0.3",
    "schemaVersion": "0.0.1",
    "name": "RADAR EDIFY KCL s1",
    "healthIssues": ["Eating Disorder"],
    "protocols": [
      {
        "name": "PHQ8",
        "showIntroduction": true,
        "showInCalendar": true,
        "isDemo": false,
        "order": 4,
        "questionnaire": {
          "repository": "https://raw.githubusercontent.com/RADAR-base/RADAR-REDCap-aRMT-Definitions/master/questionnaires/",
          "name": "phq8",
          "avsc": "questionnaire"
        },
        "startText": {
          "en": "This questionnaire is known as the PHQ8. Clinicians use it to assess current depression in patients.",
          "it": "",
          "nl": "",
          "da": "",
          "de": "",
          "es": ""
        },
        "endText": {
          "en": "Thank you for taking the time today.",
          "it": "",
          "nl": "",
          "da": "",
          "de": "",
          "es": ""
        },
        "warn": {
          "en": "",
          "it": "",
          "nl": "",
          "da": "",
          "de": "",
          "es": ""
        },
        "estimatedCompletionTime": 2,
        "protocol": {
          "repeatProtocol": {
            "unit": "day",
            "amount": 1
          },
          "repeatQuestionnaire": {
            "unit": "min",
            "unitsFromZero": [480]
          },
          "reminders": {
            "unit": "hour",
            "amount": 24,
            "repeat": 2
          },
          "completionWindow": {
            "unit": "day",
            "amount": 1
          },
          "notification": {
            "title": {
              "en": "Questionnaire time"
            },
            "text": {
              "en": "Please finish them within 3 days."
            }
          }
        }
      },
      {
        "name": "GAD7",
        "showIntroduction": true,
        "showInCalendar": true,
        "isDemo": false,
        "order": 3,
        "questionnaire": {
          "repository": "https://raw.githubusercontent.com/RADAR-base/RADAR-REDCap-aRMT-Definitions/master/questionnaires/",
          "name": "gad7",
          "avsc": "questionnaire"
        },
        "startText": {
          "en": "This questionnaire is known as the GAD7. Clinicians use it to assess anxiety.",
          "it": "",
          "nl": "",
          "da": "",
          "de": "",
          "es": ""
        },
        "endText": {
          "en": "",
          "it": "",
          "nl": "",
          "da": "",
          "de": "",
          "es": ""
        },
        "warn": {
          "en": "",
          "it": "",
          "nl": "",
          "da": "",
          "de": "",
          "es": ""
        },
        "estimatedCompletionTime": 3,
        "protocol": {
          "repeatProtocol": {
            "unit": "day",
            "amount": 1
          },
          "repeatQuestionnaire": {
            "unit": "min",
            "unitsFromZero": [480]
          },
          "reminders": {
            "unit": "hour",
            "amount": 24,
            "repeat": 2
          },
          "completionWindow": {
            "unit": "day",
            "amount": 1
          },
          "notification": {
            "title": {
              "en": "Questionnaire time"
            },
            "text": {
              "en": "Please finish them within 3 days."
            }
          }
        }
      },
      {
        "name": "ED15",
        "showIntroduction": true,
        "showInCalendar": true,
        "isDemo": false,
        "order": 8,
        "questionnaire": {
          "repository": "https://raw.githubusercontent.com/RADAR-base/RADAR-REDCap-aRMT-Definitions/master/questionnaires/",
          "name": "ed15",
          "avsc": "questionnaire"
        },
        "startText": {
          "en": "This questionnaire is known as the ED15. Clinicians use it to assess eating attitudes and behaviours over the last week.",
          "it": "",
          "nl": "",
          "da": "",
          "de": "",
          "es": ""
        },
        "endText": {
          "en": "",
          "it": "",
          "nl": "",
          "da": "",
          "de": "",
          "es": ""
        },
        "warn": {
          "en": "",
          "it": "",
          "nl": "",
          "da": "",
          "de": "",
          "es": ""
        },
        "estimatedCompletionTime": 3,
        "protocol": {
          "repeatProtocol": {
            "unit": "day",
            "amount": 1
          },
          "repeatQuestionnaire": {
            "unit": "min",
            "unitsFromZero": [480]
          },
          "reminders": {
            "unit": "hour",
            "amount": 24,
            "repeat": 2
          },
          "completionWindow": {
            "unit": "day",
            "amount": 1
          },
          "notification": {
            "title": {
              "en": "Questionnaire time"
            },
            "text": {
              "en": "Please finish them within 3 days."
            }
          }
        }
      },
      {
        "name": "SPEECH TASK",
        "showIntroduction": true,
        "showInCalendar": true,
        "isDemo": false,
        "order": 4,
        "questionnaire": {
          "repository": "https://raw.githubusercontent.com/RADAR-base/RADAR-REDCap-aRMT-Definitions/master/questionnaires/",
          "name": "audio_story",
          "avsc": "questionnaire"
        },
        "startText": {
          "en": "",
          "it": "",
          "nl": "",
          "da": "",
          "de": "",
          "es": ""
        },
        "endText": {
          "en": "Thank you for taking the time today.",
          "it": "",
          "nl": "",
          "da": "",
          "de": "",
          "es": ""
        },
        "warn": {
          "en": "Find a quiet space.",
          "it": "Trova uno spazio tranquillo.",
          "nl": "Zoek een stille ruimte.",
          "da": "Find et roligt sted.",
          "de": "Suchen Sie sich einen ruhigen Platz.",
          "es": "Encuentra un espacio tranquilo."
        },
        "estimatedCompletionTime": 2,
        "protocol": {
          "repeatProtocol": {
            "unit": "day",
            "amount": 1
          },
          "repeatQuestionnaire": {
            "unit": "min",
            "unitsFromZero": [540]
          },
          "reminders": {
            "unit": "hour",
            "amount": 24,
            "repeat": 1
          },
          "completionWindow": {
            "unit": "day",
            "amount": 1
          },
          "notification": {
            "title": {
              "en": "Questionnaire time"
            },
            "text": {
              "en": "Please finish them within 1 day."
            }
          }
        }
      },
      {
        "name": "ESM",
        "showIntroduction": true,
        "showInCalendar": true,
        "isDemo": false,
        "order": 4,
        "questionnaire": {
          "repository": "https://raw.githubusercontent.com/RADAR-base/RADAR-REDCap-aRMT-Definitions/master/questionnaires/",
          "name": "esm_story",
          "avsc": "questionnaire"
        },
        "startText": {
          "en": "This questionnaire is known as the ESM. Clinicians use it to assess subjective experiences in daily life.",
          "it": "",
          "nl": "",
          "da": "",
          "de": "",
          "es": ""
        },
        "endText": {
          "en": "Thank you for taking the time today.",
          "it": "",
          "nl": "",
          "da": "",
          "de": "",
          "es": ""
        },
        "warn": {
          "en": "",
          "it": "",
          "nl": "",
          "da": "",
          "de": "",
          "es": ""
        },
        "estimatedCompletionTime": 2,
        "protocol": {
          "repeatProtocol": {
            "unit": "day",
            "amount": 1
          },
          "repeatQuestionnaire": {
            "unit": "min",
            "unitsFromZero": [600]
          },
          "reminders": {
            "unit": "hour",
            "amount": 24,
            "repeat": 2
          },
          "completionWindow": {
            "unit": "day",
            "amount": 1
          },
          "notification": {
            "title": {
              "en": "Questionnaire time"
            },
            "text": {
              "en": "Please finish them within 3 days."
            }
          }
        }
      }
    ]
  }
  
