{
  "version": "0.0.2",
  "schemaVersion": "0.0.2",
  "name": "CoTEDS-Smart Project",
  "healthIssues": [
    "teds"
  ],
  "protocols": [
    {
      "name": "HEALTHKIT",
      "showIntroduction": "always",
      "questionnaire": {
        "repository": "https://raw.githubusercontent.com/RADAR-base/RADAR-REDCap-aRMT-Definitions/master/questionnaires/",
        "name": "healthkit_weekly",
        "avsc": "questionnaire"
      },
      "startText": {
        "en": "This task will collect your Healthkit data. Please ensure that you enable the HealthKit permissions when prompted. This will allow the RADAR app to collect your data.",
        "it": "",
        "nl": "",
        "da": "",
        "de": "",
        "es": ""
      },
      "endText": {
        "en": "",
        "it": "",
        "nl": "",
        "da": "",
        "de": "",
        "es": ""
      },
      "warn": {
        "en": "",
        "it": "",
        "nl": "",
        "da": "",
        "de": "",
        "es": ""
      },
      "estimatedCompletionTime": 3,
      "protocol": {
        "repeatProtocol": {
          "unit": "year",
          "amount": 9999
        },
        "repeatQuestionnaire": {
          "unit": "hour",
          "unitsFromZero": [
            9
          ]
        },
        "reminders": {
          "unit": "day",
          "amount": 0,
          "repeat": 0
        },
        "completionWindow": {
          "unit": "day",
          "amount": 60
        },
        "healthkitQuery": {
          "lookbackInterval": {
            "unit": "year",
            "amount": 10
          }
        }
      }
    }
  ]
}