{
  "version": "0.0.7",
  "schemaVersion": "0.0.2",
  "name": "RADAR STAGING Project",
  "healthIssues": ["depression"],
  "protocols": [
    {
      "name": "HEALTHKIT",
      "showIntroduction": true,
      "questionnaire": {
        "repository": "https://raw.githubusercontent.com/RADAR-base/RADAR-REDCap-aRMT-Definitions/master/questionnaires/",
        "name": "sample_healthkit",
        "avsc": "questionnaire"
      },
      "startText": {
        "en": "",
        "it": "",
        "nl": "",
        "da": "",
        "de": "",
        "es": ""
      },
      "endText": {
        "en": "",
        "it": "",
        "nl": "",
        "da": "",
        "de": "",
        "es": ""
      },
      "warn": {
        "en": "",
        "it": "",
        "nl": "",
        "da": "",
        "de": "",
        "es": ""
      },
      "estimatedCompletionTime": 3,
      "protocol": {
        "repeatProtocol": {
          "unit": "day",
          "amount": 1
        },
        "repeatQuestionnaire": {
          "unit": "hour",
          "unitsFromZero": [
            9
          ]
        },
        "reminders": {
          "unit": "day",
          "amount": 0,
          "repeat": 0
        }
      }
    }
  ]
}
